{
  "schema": "scds-decision-publication/1.0",
  "publication_id": "PUB-6D7094AF71C2",
  "publication_version": "1.13.0",
  "publication_type": "executive_decision_memo",
  "publication_type_label": "Executive Decision Memo",
  "title": "District Energy Modernization Decision Memo",
  "subtitle": "Governed evidence and scenario synthesis",
  "audience": "internal",
  "prepared_by": "Decision Review Team",
  "decision_packet_id": "SCDS-DISTRICT-DRAFT",
  "governance_state": "review",
  "governance_export_gate": {
    "internal_export_allowed": true,
    "reviewed_export_allowed": false,
    "public_export_allowed": false
  },
  "sections": [
    {
      "id": "executive_summary",
      "title": "Executive Summary",
      "visibility": "private",
      "content": "The expected alternative has the strongest conditional screening score. Evidence anchors: [S1] [S2]."
    },
    {
      "id": "decision_question",
      "title": "Decision Question",
      "visibility": "private",
      "content": "Which district energy modernization pathway should proceed to formal review?"
    },
    {
      "id": "recommendation",
      "title": "Recommendation",
      "visibility": "private",
      "content": "Advance the expected alternative to qualified technical and governance review."
    }
  ],
  "bibliography": [
    {
      "citation_id": "S1",
      "anchor": "[S1]",
      "title": "District energy baseline",
      "authors": [
        "Sustainable Catalyst Site Intelligence"
      ],
      "year": "2026",
      "citation": "Sustainable Catalyst Site Intelligence (2026) District energy baseline.",
      "url": "https://sustainablecatalyst.com/",
      "confidence": "validated"
    },
    {
      "citation_id": "S2",
      "anchor": "[S2]",
      "title": "Lifecycle model output",
      "authors": [
        "Sustainable Catalyst Workbench"
      ],
      "year": "2026",
      "citation": "Sustainable Catalyst Workbench (2026) Lifecycle model output.",
      "url": "https://sustainablecatalyst.com/",
      "confidence": "screening"
    }
  ],
  "citation_style": "Harvard",
  "redaction": {
    "schema": "scds-publication-redaction/1.0",
    "required": false,
    "rules_applied": 0,
    "events": [],
    "complete": true
  },
  "publication_handoffs": [
    {
      "schema": "scds-publication-handoff/1.0",
      "handoff_id": "pub-PUB-6D7094AF71C2-publications",
      "target": "publications",
      "status": "draft",
      "publication_id": "PUB-6D7094AF71C2",
      "decision_packet_id": "SCDS-DISTRICT-DRAFT",
      "title": "District Energy Modernization Decision Memo",
      "publication_type": "executive_decision_memo",
      "audience": "internal",
      "content_hash": "sha256:0000000000000000000000000000000000000000000000000000000000000000",
      "governance_state": "review",
      "review_required": true
    }
  ],
  "content_hash": "sha256:0000000000000000000000000000000000000000000000000000000000000000",
  "markdown": "# District Energy Modernization Decision Memo\n",
  "html": "<article><h1>District Energy Modernization Decision Memo</h1></article>",
  "warnings": [
    "Publication templates do not approve, certify, assure, or professionally sign off a decision."
  ]
}
